{
  "completed_at": "2026-07-21T12:31:16.001025Z",
  "errors": [],
  "input": {
    "expected_tool_sequence": [
      "get_sales_data",
      "aggregate_data",
      "format_report"
    ],
    "user_request": "Create a compact year-to-date sales report by region."
  },
  "latency_ms": 7566,
  "metrics": {
    "fallback_count": 0,
    "retry_count": 0,
    "schema_validation_failures": 0,
    "task_success": true,
    "tool_execution_failures": 0
  },
  "model": {
    "name": "qwen2.5:7b-instruct",
    "provider": "ollama",
    "seed": 0,
    "temperature": 0.0
  },
  "output": {
    "final_response": "R005 completed by fixed-sequence LLM parameter mapping with result format_report:a8a3cf863fd8.",
    "output_hash": "format_report:0ebdc8936ba3"
  },
  "repetition_index": 2,
  "request_id": "R005",
  "run_id": "66c9bd17-0380-4e18-820b-e20712165705",
  "schema_version": "0.1.0",
  "started_at": "2026-07-21T12:31:08.434497Z",
  "status": "success",
  "tool_calls": [
    {
      "arguments": {
        "dimensions": [
          "date",
          "region"
        ],
        "timeframe": "year_to_date"
      },
      "index": 0,
      "latency_ms": 0,
      "result_ref": "get_sales_data:15a16522b86f",
      "source": "llm",
      "status": "executed",
      "tool_name": "get_sales_data"
    },
    {
      "arguments": {
        "data_id": "get_sales_data:15a16522b86f",
        "group_by": [
          "region",
          "date"
        ],
        "metrics": [
          "revenue"
        ]
      },
      "index": 1,
      "latency_ms": 0,
      "result_ref": "aggregate_data:79720f4bd2d8",
      "source": "llm",
      "status": "executed",
      "tool_name": "aggregate_data"
    },
    {
      "arguments": {
        "data_id": "aggregate_data:79720f4bd2d8",
        "output_format": "markdown"
      },
      "index": 2,
      "latency_ms": 0,
      "result_ref": "format_report:a8a3cf863fd8",
      "source": "llm",
      "status": "executed",
      "tool_name": "format_report"
    }
  ],
  "validation_events": [],
  "variant": "fixed_sequence_llm_parameters"
}
