{
  "completed_at": "2026-07-26T07:19:43.763580Z",
  "errors": [],
  "input": {
    "expected_tool_sequence": [
      "get_sales_data",
      "aggregate_data",
      "compare_previous_period",
      "format_report"
    ],
    "user_request": "Compare this year's sales so far with last year's sales."
  },
  "latency_ms": 0,
  "metrics": {
    "fallback_count": 0,
    "retry_count": 0,
    "schema_validation_failures": 0,
    "task_success": true,
    "tool_execution_failures": 0
  },
  "model": {
    "name": "oracle_backed_multi_step_planner",
    "provider": "local",
    "seed": 0,
    "temperature": 0.0
  },
  "output": {
    "final_response": "R016 completed by LLM multi-step planning with result format_report:42bb3889be8e.",
    "output_hash": "format_report:71a0d198686c"
  },
  "repetition_index": 0,
  "request_id": "R016",
  "run_id": "64f707ac-e5eb-4ce9-8bb0-fe45dcbb2c5c",
  "schema_version": "0.1.0",
  "started_at": "2026-07-26T07:19:43.763445Z",
  "status": "success",
  "tool_calls": [
    {
      "arguments": {
        "dimensions": [
          "date"
        ],
        "timeframe": "year_to_date"
      },
      "index": 0,
      "latency_ms": 0,
      "result_ref": "get_sales_data:21b8b5a35e45",
      "source": "llm",
      "status": "executed",
      "tool_name": "get_sales_data"
    },
    {
      "arguments": {
        "data_id": "get_sales_data:21b8b5a35e45",
        "group_by": [
          "date"
        ],
        "metrics": [
          "revenue"
        ]
      },
      "index": 1,
      "latency_ms": 0,
      "result_ref": "aggregate_data:0cebf409ce60",
      "source": "llm",
      "status": "executed",
      "tool_name": "aggregate_data"
    },
    {
      "arguments": {
        "data_id": "aggregate_data:0cebf409ce60",
        "previous_period": "previous_year"
      },
      "index": 2,
      "latency_ms": 0,
      "result_ref": "compare_previous_period:3ebab8ef09cd",
      "source": "llm",
      "status": "executed",
      "tool_name": "compare_previous_period"
    },
    {
      "arguments": {
        "data_id": "compare_previous_period:3ebab8ef09cd",
        "output_format": "markdown"
      },
      "index": 3,
      "latency_ms": 0,
      "result_ref": "format_report:42bb3889be8e",
      "source": "llm",
      "status": "executed",
      "tool_name": "format_report"
    }
  ],
  "validation_events": [],
  "variant": "llm_multi_step_planning"
}
