{
  "completed_at": "2026-07-10T12:11:53.051693Z",
  "errors": [],
  "input": {
    "expected_tool_sequence": [
      "get_sales_data",
      "aggregate_data",
      "format_report"
    ],
    "user_request": "Summarize current quarter average order value by region without comparisons."
  },
  "latency_ms": 0,
  "metrics": {
    "fallback_count": 0,
    "retry_count": 0,
    "schema_validation_failures": 0,
    "task_success": true,
    "tool_execution_failures": 0
  },
  "output": {
    "final_response": "R024 completed by deterministic workflow with result format_report:efa7b611cd89.",
    "output_hash": "format_report:4921b35e5409"
  },
  "repetition_index": 0,
  "request_id": "R024",
  "run_id": "5fc60799-5e75-4c87-87c0-53aca8e63161",
  "schema_version": "0.1.0",
  "started_at": "2026-07-10T12:11:53.051584Z",
  "status": "success",
  "tool_calls": [
    {
      "arguments": {
        "dimensions": [
          "region"
        ],
        "timeframe": "current_quarter"
      },
      "index": 0,
      "latency_ms": 0,
      "result_ref": "get_sales_data:9787141fcf1d",
      "source": "deterministic",
      "status": "executed",
      "tool_name": "get_sales_data"
    },
    {
      "arguments": {
        "data_id": "get_sales_data:9787141fcf1d",
        "group_by": [
          "region"
        ],
        "metrics": [
          "average_order_value"
        ]
      },
      "index": 1,
      "latency_ms": 0,
      "result_ref": "aggregate_data:c4cb20ccba50",
      "source": "deterministic",
      "status": "executed",
      "tool_name": "aggregate_data"
    },
    {
      "arguments": {
        "data_id": "aggregate_data:c4cb20ccba50",
        "output_format": "markdown"
      },
      "index": 2,
      "latency_ms": 0,
      "result_ref": "format_report:efa7b611cd89",
      "source": "deterministic",
      "status": "executed",
      "tool_name": "format_report"
    }
  ],
  "validation_events": [],
  "variant": "deterministic_workflow"
}
