{
  "completed_at": "2026-07-26T07:30:11.756249Z",
  "errors": [
    {
      "code": "E3",
      "description": "The planner added at least one unnecessary tool call.",
      "tool_call_index": 3
    }
  ],
  "input": {
    "expected_tool_sequence": [
      "get_sales_data",
      "aggregate_data",
      "format_report"
    ],
    "user_request": "Return last month's revenue by region as JSON."
  },
  "latency_ms": 12468,
  "metrics": {
    "fallback_count": 0,
    "retry_count": 0,
    "schema_validation_failures": 0,
    "task_success": false,
    "tool_execution_failures": 0
  },
  "model": {
    "name": "qwen2.5:7b-instruct",
    "provider": "ollama",
    "seed": 0,
    "temperature": 0.0
  },
  "output": {
    "final_response": "R013 completed by LLM multi-step planning with result format_report:fe761e8216c2.",
    "output_hash": "format_report:e9cb61f94767"
  },
  "repetition_index": 0,
  "request_id": "R013",
  "run_id": "6bcbffdd-c457-46b8-bfa9-dddbf36eeb22",
  "schema_version": "0.1.0",
  "started_at": "2026-07-26T07:29:59.287708Z",
  "status": "rejected",
  "tool_calls": [
    {
      "arguments": {
        "dimensions": [
          "region"
        ],
        "timeframe": "previous_month"
      },
      "index": 0,
      "latency_ms": 0,
      "result_ref": "get_sales_data:990a1aaaa813",
      "source": "llm",
      "status": "executed",
      "tool_name": "get_sales_data"
    },
    {
      "arguments": {
        "data_id": "get_sales_data:990a1aaaa813",
        "group_by": [
          "region"
        ],
        "metrics": [
          "revenue"
        ]
      },
      "index": 1,
      "latency_ms": 0,
      "result_ref": "aggregate_data:f728620d4c25",
      "source": "llm",
      "status": "executed",
      "tool_name": "aggregate_data"
    },
    {
      "arguments": {
        "data_id": "aggregate_data:f728620d4c25",
        "output_format": "json"
      },
      "index": 2,
      "latency_ms": 0,
      "result_ref": "format_report:fe761e8216c2",
      "source": "llm",
      "status": "executed",
      "tool_name": "format_report"
    },
    {
      "arguments": {
        "data_id": "aggregate_data:f728620d4c25",
        "output_format": "json"
      },
      "index": 3,
      "latency_ms": 0,
      "source": "llm",
      "status": "proposed",
      "tool_name": "format_report"
    }
  ],
  "validation_events": [
    {
      "event_type": "semantic_validation_failed",
      "index": 0,
      "message": "Planner selected unnecessary tool after completion: format_report",
      "tool_call_index": 3
    }
  ],
  "variant": "llm_multi_step_planning"
}
