{
  "completed_at": "2026-07-19T08:54:51.728446Z",
  "errors": [],
  "input": {
    "expected_tool_sequence": [
      "get_sales_data",
      "aggregate_data",
      "compare_previous_period",
      "format_report"
    ],
    "user_request": "Compare revenue from the last 30 days with the same period in the previous year."
  },
  "latency_ms": 10266,
  "metrics": {
    "fallback_count": 0,
    "retry_count": 0,
    "schema_validation_failures": 0,
    "task_success": true,
    "tool_execution_failures": 0
  },
  "model": {
    "name": "qwen2.5:7b-instruct",
    "provider": "ollama",
    "seed": 0,
    "temperature": 0.0
  },
  "output": {
    "final_response": "R008 completed by fixed-sequence LLM parameter mapping with result format_report:b5813ccf5e4a.",
    "output_hash": "format_report:1fdb72b31313"
  },
  "repetition_index": 0,
  "request_id": "R008",
  "run_id": "ccaefe86-e92d-45c5-933d-81b65cd25d5e",
  "schema_version": "0.1.0",
  "started_at": "2026-07-19T08:54:41.462381Z",
  "status": "success",
  "tool_calls": [
    {
      "arguments": {
        "dimensions": [
          "date"
        ],
        "timeframe": "last_30_days"
      },
      "index": 0,
      "latency_ms": 0,
      "result_ref": "get_sales_data:213db408ff98",
      "source": "llm",
      "status": "executed",
      "tool_name": "get_sales_data"
    },
    {
      "arguments": {
        "data_id": "get_sales_data:213db408ff98",
        "group_by": [
          "date"
        ],
        "metrics": [
          "revenue"
        ]
      },
      "index": 1,
      "latency_ms": 0,
      "result_ref": "aggregate_data:8bfde736ec4b",
      "source": "llm",
      "status": "executed",
      "tool_name": "aggregate_data"
    },
    {
      "arguments": {
        "data_id": "aggregate_data:8bfde736ec4b",
        "previous_period": "same_period_previous_year"
      },
      "index": 2,
      "latency_ms": 0,
      "result_ref": "compare_previous_period:09fe01af152f",
      "source": "llm",
      "status": "executed",
      "tool_name": "compare_previous_period"
    },
    {
      "arguments": {
        "data_id": "compare_previous_period:09fe01af152f",
        "output_format": "markdown"
      },
      "index": 3,
      "latency_ms": 0,
      "result_ref": "format_report:b5813ccf5e4a",
      "source": "llm",
      "status": "executed",
      "tool_name": "format_report"
    }
  ],
  "validation_events": [],
  "variant": "fixed_sequence_llm_parameters"
}
