{
  "completed_at": "2026-07-21T12:42:50.623353Z",
  "errors": [],
  "input": {
    "expected_tool_sequence": [
      "get_sales_data",
      "aggregate_data",
      "compare_previous_period",
      "format_report"
    ],
    "user_request": "Compare units sold in the previous month with the month before."
  },
  "latency_ms": 9965,
  "metrics": {
    "fallback_count": 0,
    "retry_count": 0,
    "schema_validation_failures": 0,
    "task_success": true,
    "tool_execution_failures": 0
  },
  "model": {
    "name": "qwen2.5:7b-instruct",
    "provider": "ollama",
    "seed": 0,
    "temperature": 0.0
  },
  "output": {
    "final_response": "R022 completed by fixed-sequence LLM parameter mapping with result format_report:d360e587ac7f.",
    "output_hash": "format_report:5c558ee97bc6"
  },
  "repetition_index": 1,
  "request_id": "R022",
  "run_id": "5fa9b15d-05fd-4e2a-86a3-f37234b60d0d",
  "schema_version": "0.1.0",
  "started_at": "2026-07-21T12:42:40.658299Z",
  "status": "success",
  "tool_calls": [
    {
      "arguments": {
        "dimensions": [
          "date"
        ],
        "timeframe": "previous_month"
      },
      "index": 0,
      "latency_ms": 0,
      "result_ref": "get_sales_data:0bea13e5fb8d",
      "source": "llm",
      "status": "executed",
      "tool_name": "get_sales_data"
    },
    {
      "arguments": {
        "data_id": "get_sales_data:0bea13e5fb8d",
        "group_by": [
          "date"
        ],
        "metrics": [
          "units_sold"
        ]
      },
      "index": 1,
      "latency_ms": 0,
      "result_ref": "aggregate_data:1541545976bf",
      "source": "llm",
      "status": "executed",
      "tool_name": "aggregate_data"
    },
    {
      "arguments": {
        "data_id": "aggregate_data:1541545976bf",
        "previous_period": "previous_month"
      },
      "index": 2,
      "latency_ms": 0,
      "result_ref": "compare_previous_period:fdb431a69eaa",
      "source": "llm",
      "status": "executed",
      "tool_name": "compare_previous_period"
    },
    {
      "arguments": {
        "data_id": "compare_previous_period:fdb431a69eaa",
        "output_format": "markdown"
      },
      "index": 3,
      "latency_ms": 0,
      "result_ref": "format_report:d360e587ac7f",
      "source": "llm",
      "status": "executed",
      "tool_name": "format_report"
    }
  ],
  "validation_events": [],
  "variant": "fixed_sequence_llm_parameters"
}
