{
  "completed_at": "2026-07-23T16:30:00.109589Z",
  "errors": [],
  "input": {
    "expected_tool_sequence": [
      "get_sales_data",
      "aggregate_data",
      "format_report"
    ],
    "user_request": "Give me only a simple daily revenue summary for the last 7 days."
  },
  "latency_ms": 0,
  "metrics": {
    "fallback_count": 0,
    "retry_count": 0,
    "schema_validation_failures": 0,
    "task_success": true,
    "tool_execution_failures": 0
  },
  "model": {
    "name": "oracle_backed_tool_call_planner",
    "provider": "local",
    "seed": 0,
    "temperature": 0.0
  },
  "output": {
    "final_response": "R023 completed by LLM tool selection with result format_report:7dd4f96c0795.",
    "output_hash": "format_report:d3e20e75cf00"
  },
  "repetition_index": 0,
  "request_id": "R023",
  "run_id": "3de80b44-80e0-4172-b57c-78ee2116e260",
  "schema_version": "0.1.0",
  "started_at": "2026-07-23T16:30:00.109472Z",
  "status": "success",
  "tool_calls": [
    {
      "arguments": {
        "dimensions": [
          "date"
        ],
        "timeframe": "last_7_days"
      },
      "index": 0,
      "latency_ms": 0,
      "result_ref": "get_sales_data:932645a6f575",
      "source": "llm",
      "status": "executed",
      "tool_name": "get_sales_data"
    },
    {
      "arguments": {
        "data_id": "get_sales_data:932645a6f575",
        "group_by": [
          "date"
        ],
        "metrics": [
          "revenue"
        ]
      },
      "index": 1,
      "latency_ms": 0,
      "result_ref": "aggregate_data:a0a512453704",
      "source": "llm",
      "status": "executed",
      "tool_name": "aggregate_data"
    },
    {
      "arguments": {
        "data_id": "aggregate_data:a0a512453704",
        "output_format": "markdown"
      },
      "index": 2,
      "latency_ms": 0,
      "result_ref": "format_report:7dd4f96c0795",
      "source": "llm",
      "status": "executed",
      "tool_name": "format_report"
    }
  ],
  "validation_events": [],
  "variant": "llm_tool_selection"
}
