{
  "completed_at": "2026-07-17T12:59:13.836182Z",
  "errors": [],
  "input": {
    "expected_tool_sequence": [
      "get_sales_data",
      "aggregate_data",
      "compare_previous_period",
      "format_report"
    ],
    "user_request": "Compare current quarter revenue by region with the previous quarter."
  },
  "latency_ms": 0,
  "metrics": {
    "fallback_count": 0,
    "retry_count": 0,
    "schema_validation_failures": 0,
    "task_success": true,
    "tool_execution_failures": 0
  },
  "model": {
    "name": "oracle_backed_parameter_mapper",
    "provider": "local",
    "seed": 0,
    "temperature": 0.0
  },
  "output": {
    "final_response": "R028 completed by fixed-sequence LLM parameter mapping with result format_report:a7484f03ef5c.",
    "output_hash": "format_report:6ec5ea4b9644"
  },
  "repetition_index": 0,
  "request_id": "R028",
  "run_id": "9901b62e-cd1b-440c-8eb1-2109824820cc",
  "schema_version": "0.1.0",
  "started_at": "2026-07-17T12:59:13.836061Z",
  "status": "success",
  "tool_calls": [
    {
      "arguments": {
        "dimensions": [
          "region"
        ],
        "timeframe": "current_quarter"
      },
      "index": 0,
      "latency_ms": 0,
      "result_ref": "get_sales_data:9787141fcf1d",
      "source": "llm",
      "status": "executed",
      "tool_name": "get_sales_data"
    },
    {
      "arguments": {
        "data_id": "get_sales_data:9787141fcf1d",
        "group_by": [
          "region"
        ],
        "metrics": [
          "revenue"
        ]
      },
      "index": 1,
      "latency_ms": 0,
      "result_ref": "aggregate_data:b446e234f5d8",
      "source": "llm",
      "status": "executed",
      "tool_name": "aggregate_data"
    },
    {
      "arguments": {
        "data_id": "aggregate_data:b446e234f5d8",
        "previous_period": "previous_quarter"
      },
      "index": 2,
      "latency_ms": 0,
      "result_ref": "compare_previous_period:8ffb261748e1",
      "source": "llm",
      "status": "executed",
      "tool_name": "compare_previous_period"
    },
    {
      "arguments": {
        "data_id": "compare_previous_period:8ffb261748e1",
        "output_format": "markdown"
      },
      "index": 3,
      "latency_ms": 0,
      "result_ref": "format_report:a7484f03ef5c",
      "source": "llm",
      "status": "executed",
      "tool_name": "format_report"
    }
  ],
  "validation_events": [],
  "variant": "fixed_sequence_llm_parameters"
}
