{
  "completed_at": "2026-07-21T12:46:52.935845Z",
  "errors": [
    {
      "code": "E4",
      "description": "Invalid mapped parameters for get_sales_data.",
      "tool_call_index": 0
    }
  ],
  "input": {
    "expected_tool_sequence": [
      "get_sales_data",
      "aggregate_data",
      "compare_previous_period",
      "format_report"
    ],
    "user_request": "Compare current quarter revenue by region with the previous quarter."
  },
  "latency_ms": 2425,
  "metrics": {
    "fallback_count": 0,
    "retry_count": 0,
    "schema_validation_failures": 1,
    "task_success": false,
    "tool_execution_failures": 0
  },
  "model": {
    "name": "qwen2.5:7b-instruct",
    "provider": "ollama",
    "seed": 0,
    "temperature": 0.0
  },
  "output": {
    "final_response": "R028 completed by fixed-sequence LLM parameter mapping with result None.",
    "output_hash": "format_report:04e703af6690"
  },
  "repetition_index": 3,
  "request_id": "R028",
  "run_id": "69423f74-5940-4ed3-8663-9defa6732c1c",
  "schema_version": "0.1.0",
  "started_at": "2026-07-21T12:46:50.510354Z",
  "status": "rejected",
  "tool_calls": [
    {
      "arguments": {
        "dimensions": [
          "region",
          "date"
        ],
        "timeframe": "previous_quarter/current_quarter"
      },
      "index": 0,
      "latency_ms": 0,
      "source": "llm",
      "status": "rejected",
      "tool_name": "get_sales_data"
    }
  ],
  "validation_events": [
    {
      "event_type": "schema_validation_failed",
      "index": 0,
      "message": "'previous_quarter/current_quarter' is not valid under any of the given schemas",
      "tool_call_index": 0
    }
  ],
  "variant": "fixed_sequence_llm_parameters"
}
