{
  "completed_at": "2026-07-21T12:38:40.592269Z",
  "errors": [],
  "input": {
    "expected_tool_sequence": [
      "get_sales_data",
      "aggregate_data",
      "compare_previous_period",
      "format_report"
    ],
    "user_request": "Compare the previous quarter's gross margin with the quarter before it."
  },
  "latency_ms": 10087,
  "metrics": {
    "fallback_count": 0,
    "retry_count": 0,
    "schema_validation_failures": 0,
    "task_success": true,
    "tool_execution_failures": 0
  },
  "model": {
    "name": "qwen2.5:7b-instruct",
    "provider": "ollama",
    "seed": 0,
    "temperature": 0.0
  },
  "output": {
    "final_response": "R015 completed by fixed-sequence LLM parameter mapping with result format_report:3718fb8f23a1.",
    "output_hash": "format_report:815d94fcf0e4"
  },
  "repetition_index": 4,
  "request_id": "R015",
  "run_id": "1f6bbcb5-2dee-413f-a0f1-6385c8cc1d2b",
  "schema_version": "0.1.0",
  "started_at": "2026-07-21T12:38:30.504516Z",
  "status": "success",
  "tool_calls": [
    {
      "arguments": {
        "dimensions": [
          "date"
        ],
        "timeframe": "previous_quarter"
      },
      "index": 0,
      "latency_ms": 0,
      "result_ref": "get_sales_data:7dabb181c8a7",
      "source": "llm",
      "status": "executed",
      "tool_name": "get_sales_data"
    },
    {
      "arguments": {
        "data_id": "get_sales_data:7dabb181c8a7",
        "group_by": [
          "date"
        ],
        "metrics": [
          "gross_margin"
        ]
      },
      "index": 1,
      "latency_ms": 0,
      "result_ref": "aggregate_data:e675b904633c",
      "source": "llm",
      "status": "executed",
      "tool_name": "aggregate_data"
    },
    {
      "arguments": {
        "data_id": "aggregate_data:e675b904633c",
        "previous_period": "previous_quarter"
      },
      "index": 2,
      "latency_ms": 0,
      "result_ref": "compare_previous_period:6905708cce0c",
      "source": "llm",
      "status": "executed",
      "tool_name": "compare_previous_period"
    },
    {
      "arguments": {
        "data_id": "compare_previous_period:6905708cce0c",
        "output_format": "markdown"
      },
      "index": 3,
      "latency_ms": 0,
      "result_ref": "format_report:3718fb8f23a1",
      "source": "llm",
      "status": "executed",
      "tool_name": "format_report"
    }
  ],
  "validation_events": [],
  "variant": "fixed_sequence_llm_parameters"
}
