{
  "completed_at": "2026-07-21T12:32:52.147180Z",
  "errors": [],
  "input": {
    "expected_tool_sequence": [
      "get_sales_data",
      "aggregate_data",
      "format_report"
    ],
    "user_request": "Prepare a sales report for the previous quarter grouped by region and product category."
  },
  "latency_ms": 7580,
  "metrics": {
    "fallback_count": 0,
    "retry_count": 0,
    "schema_validation_failures": 0,
    "task_success": true,
    "tool_execution_failures": 0
  },
  "model": {
    "name": "qwen2.5:7b-instruct",
    "provider": "ollama",
    "seed": 0,
    "temperature": 0.0
  },
  "output": {
    "final_response": "R007 completed by fixed-sequence LLM parameter mapping with result format_report:a7facdbd4fef.",
    "output_hash": "format_report:d97018ff620f"
  },
  "repetition_index": 3,
  "request_id": "R007",
  "run_id": "c5c4fd49-904c-420d-8848-b2ac32b93c1b",
  "schema_version": "0.1.0",
  "started_at": "2026-07-21T12:32:44.566635Z",
  "status": "success",
  "tool_calls": [
    {
      "arguments": {
        "dimensions": [
          "region",
          "category"
        ],
        "timeframe": "previous_quarter"
      },
      "index": 0,
      "latency_ms": 0,
      "result_ref": "get_sales_data:2f4acad8bce7",
      "source": "llm",
      "status": "executed",
      "tool_name": "get_sales_data"
    },
    {
      "arguments": {
        "data_id": "get_sales_data:2f4acad8bce7",
        "group_by": [
          "region",
          "category"
        ],
        "metrics": [
          "revenue"
        ]
      },
      "index": 1,
      "latency_ms": 0,
      "result_ref": "aggregate_data:f976cbab6ca2",
      "source": "llm",
      "status": "executed",
      "tool_name": "aggregate_data"
    },
    {
      "arguments": {
        "data_id": "aggregate_data:f976cbab6ca2",
        "output_format": "markdown"
      },
      "index": 2,
      "latency_ms": 0,
      "result_ref": "format_report:a7facdbd4fef",
      "source": "llm",
      "status": "executed",
      "tool_name": "format_report"
    }
  ],
  "validation_events": [],
  "variant": "fixed_sequence_llm_parameters"
}
