{
  "completed_at": "2026-07-21T12:48:17.250129Z",
  "errors": [],
  "input": {
    "expected_tool_sequence": [
      "get_sales_data",
      "aggregate_data",
      "format_report"
    ],
    "user_request": "Create a previous-quarter report by sales channel including revenue, units sold, and gross margin."
  },
  "latency_ms": 7618,
  "metrics": {
    "fallback_count": 0,
    "retry_count": 0,
    "schema_validation_failures": 0,
    "task_success": true,
    "tool_execution_failures": 0
  },
  "model": {
    "name": "qwen2.5:7b-instruct",
    "provider": "ollama",
    "seed": 0,
    "temperature": 0.0
  },
  "output": {
    "final_response": "R030 completed by fixed-sequence LLM parameter mapping with result format_report:5f011f245264.",
    "output_hash": "format_report:8f14519660d9"
  },
  "repetition_index": 3,
  "request_id": "R030",
  "run_id": "70d6ef54-b13d-4bdc-a02b-c5182e353858",
  "schema_version": "0.1.0",
  "started_at": "2026-07-21T12:48:09.631496Z",
  "status": "success",
  "tool_calls": [
    {
      "arguments": {
        "dimensions": [
          "sales_channel"
        ],
        "timeframe": "previous_quarter"
      },
      "index": 0,
      "latency_ms": 0,
      "result_ref": "get_sales_data:fcf3e3c2f930",
      "source": "llm",
      "status": "executed",
      "tool_name": "get_sales_data"
    },
    {
      "arguments": {
        "data_id": "get_sales_data:fcf3e3c2f930",
        "group_by": [
          "sales_channel"
        ],
        "metrics": [
          "revenue",
          "units_sold",
          "gross_margin"
        ]
      },
      "index": 1,
      "latency_ms": 0,
      "result_ref": "aggregate_data:3653d2c0e07b",
      "source": "llm",
      "status": "executed",
      "tool_name": "aggregate_data"
    },
    {
      "arguments": {
        "data_id": "aggregate_data:3653d2c0e07b",
        "output_format": "markdown"
      },
      "index": 2,
      "latency_ms": 0,
      "result_ref": "format_report:5f011f245264",
      "source": "llm",
      "status": "executed",
      "tool_name": "format_report"
    }
  ],
  "validation_events": [],
  "variant": "fixed_sequence_llm_parameters"
}
