{
  "completed_at": "2026-07-23T16:31:40.349558Z",
  "errors": [
    {
      "code": "E2",
      "description": "The planner omitted at least one required tool call."
    }
  ],
  "input": {
    "expected_tool_sequence": [
      "get_sales_data",
      "aggregate_data",
      "format_report"
    ],
    "user_request": "Generate an HTML report for year-to-date units sold by product."
  },
  "latency_ms": 3388,
  "metrics": {
    "fallback_count": 0,
    "retry_count": 0,
    "schema_validation_failures": 0,
    "task_success": false,
    "tool_execution_failures": 0
  },
  "model": {
    "name": "qwen2.5:7b-instruct",
    "provider": "ollama",
    "seed": 0,
    "temperature": 0.0
  },
  "output": {
    "final_response": "R014 completed by LLM tool selection with result None.",
    "output_hash": "format_report:16725db29892"
  },
  "repetition_index": 0,
  "request_id": "R014",
  "run_id": "e2a44640-5712-4056-bf85-706865edefe3",
  "schema_version": "0.1.0",
  "started_at": "2026-07-23T16:31:36.961167Z",
  "status": "rejected",
  "tool_calls": [
    {
      "arguments": {
        "dimensions": [
          "product"
        ],
        "timeframe": "year_to_date"
      },
      "index": 0,
      "latency_ms": 0,
      "source": "llm",
      "status": "proposed",
      "tool_name": "get_sales_data"
    },
    {
      "arguments": {
        "data_id": "$previous_result",
        "output_format": "html"
      },
      "index": 1,
      "latency_ms": 0,
      "source": "llm",
      "status": "proposed",
      "tool_name": "format_report"
    }
  ],
  "validation_events": [
    {
      "event_type": "semantic_validation_failed",
      "index": 0,
      "message": "Planned tool sequence omits required calls: planned=['get_sales_data', 'format_report'], expected=['get_sales_data', 'aggregate_data', 'format_report']"
    }
  ],
  "variant": "llm_tool_selection"
}
