{
  "completed_at": "2026-07-21T12:36:57.297256Z",
  "errors": [],
  "input": {
    "expected_tool_sequence": [
      "get_sales_data",
      "aggregate_data",
      "format_report"
    ],
    "user_request": "Return last month's revenue by region as JSON."
  },
  "latency_ms": 7447,
  "metrics": {
    "fallback_count": 0,
    "retry_count": 0,
    "schema_validation_failures": 0,
    "task_success": true,
    "tool_execution_failures": 0
  },
  "model": {
    "name": "qwen2.5:7b-instruct",
    "provider": "ollama",
    "seed": 0,
    "temperature": 0.0
  },
  "output": {
    "final_response": "R013 completed by fixed-sequence LLM parameter mapping with result format_report:fe761e8216c2.",
    "output_hash": "format_report:e95142dea8a1"
  },
  "repetition_index": 2,
  "request_id": "R013",
  "run_id": "ebdb2143-0360-4477-8bed-f4804d6b4e85",
  "schema_version": "0.1.0",
  "started_at": "2026-07-21T12:36:49.849285Z",
  "status": "success",
  "tool_calls": [
    {
      "arguments": {
        "dimensions": [
          "region"
        ],
        "timeframe": "previous_month"
      },
      "index": 0,
      "latency_ms": 0,
      "result_ref": "get_sales_data:990a1aaaa813",
      "source": "llm",
      "status": "executed",
      "tool_name": "get_sales_data"
    },
    {
      "arguments": {
        "data_id": "get_sales_data:990a1aaaa813",
        "group_by": [
          "region"
        ],
        "metrics": [
          "revenue"
        ]
      },
      "index": 1,
      "latency_ms": 0,
      "result_ref": "aggregate_data:f728620d4c25",
      "source": "llm",
      "status": "executed",
      "tool_name": "aggregate_data"
    },
    {
      "arguments": {
        "data_id": "aggregate_data:f728620d4c25",
        "output_format": "json"
      },
      "index": 2,
      "latency_ms": 0,
      "result_ref": "format_report:fe761e8216c2",
      "source": "llm",
      "status": "executed",
      "tool_name": "format_report"
    }
  ],
  "validation_events": [],
  "variant": "fixed_sequence_llm_parameters"
}
