{
  "completed_at": "2026-07-23T16:30:00.096298Z",
  "errors": [],
  "input": {
    "expected_tool_sequence": [
      "get_sales_data",
      "aggregate_data",
      "detect_anomalies",
      "format_report"
    ],
    "user_request": "Show daily revenue trends for the last 30 days and identify anomalies."
  },
  "latency_ms": 0,
  "metrics": {
    "fallback_count": 0,
    "retry_count": 0,
    "schema_validation_failures": 0,
    "task_success": true,
    "tool_execution_failures": 0
  },
  "model": {
    "name": "oracle_backed_tool_call_planner",
    "provider": "local",
    "seed": 0,
    "temperature": 0.0
  },
  "output": {
    "final_response": "R004 completed by LLM tool selection with result format_report:7d5f71f1590d.",
    "output_hash": "format_report:7e6c6d898caa"
  },
  "repetition_index": 0,
  "request_id": "R004",
  "run_id": "229c429d-5201-4317-b3a3-8af525ec9d19",
  "schema_version": "0.1.0",
  "started_at": "2026-07-23T16:30:00.096164Z",
  "status": "success",
  "tool_calls": [
    {
      "arguments": {
        "dimensions": [
          "date"
        ],
        "timeframe": "last_30_days"
      },
      "index": 0,
      "latency_ms": 0,
      "result_ref": "get_sales_data:213db408ff98",
      "source": "llm",
      "status": "executed",
      "tool_name": "get_sales_data"
    },
    {
      "arguments": {
        "data_id": "get_sales_data:213db408ff98",
        "group_by": [
          "date"
        ],
        "metrics": [
          "revenue"
        ]
      },
      "index": 1,
      "latency_ms": 0,
      "result_ref": "aggregate_data:8bfde736ec4b",
      "source": "llm",
      "status": "executed",
      "tool_name": "aggregate_data"
    },
    {
      "arguments": {
        "data_id": "aggregate_data:8bfde736ec4b",
        "method": "z_score",
        "threshold": 3.0
      },
      "index": 2,
      "latency_ms": 0,
      "result_ref": "detect_anomalies:cda687e9e2c8",
      "source": "llm",
      "status": "executed",
      "tool_name": "detect_anomalies"
    },
    {
      "arguments": {
        "data_id": "detect_anomalies:cda687e9e2c8",
        "output_format": "markdown"
      },
      "index": 3,
      "latency_ms": 0,
      "result_ref": "format_report:7d5f71f1590d",
      "source": "llm",
      "status": "executed",
      "tool_name": "format_report"
    }
  ],
  "validation_events": [],
  "variant": "llm_tool_selection"
}
